Short Name,Full Name,Year,Term,Faculty,Course Types,Credits,Instructors,TAs,Assessment count,Session count,Course outcomes: all,,,,,,,,,,,,,,,,,,,,,,,,,,,,,,,,,,,,,,,,,,,,,,,,,,,,,,,,,PHARM 361 (Fall 2018 LAB D1 D2 D3 LEC A1 SEM E1),PHARM 361 Fa18 - PHARMACEUTICS 2 Combined LAB LEC SEM Fa18,2018,Fall,Cross Listed Courses,"Pharmaceutical Sciences,, BSc in Pharmacy, 2nd year",3,Afsaneh Lavasanifar,,4,46,Explain how Health Canada Guidelines (GMP and GLP) are related to the pharmacistâ€™s role in compounding.,"Gain and apply knowledge on the formulation needs and process involved for the manufacturing of solid dosage forms, controlled release products, transdermal delivery systems and aerosols in pharmaceutical industry",Apply knowledge of sterility requirements,Explain how to maintain a clean work environment,Explain importance of quality of ingredients including bioburden,Identify risks of cross contamination in a laminar flow work bench,Explain importance of monitoring programs and training of personnel,Apply appropriate parenteral technique in clinical situations.,"Develop skills and techniques that are important for the handling of drugs, excipients and pharmaceutical equipment and instruments.",Apply modern pharmacopeia standards and methods to assess the quality of dosage forms,Evaluate and interpret literature with respect to existing and new dosage forms as related to Pharmaceutics and Compounding procedures. ,Demonstrate appropriate documentation practices in compounding.,Perform compounding and packaging of drug products in small quantities according to legal and professional standards,Evaluate the stability and the shelf life of drugs under different storage conditions,Conduct quality control of the final product,Identify and locate sources of information needed to solve a problem related to Pharmaceutics,Critically evaluate the appropriateness and reliability of information from literature resources related to Pharmaceutics.,Synthesize information gained from various literature resources to solve problems or make recommendations related to Pharmaceutics,"Interpret official compendia standards and specifications for pharmaceutical preparations including USP standards, International pharmacopoeias, and Professional standards.",Perform aseptic compounding techniques,Evaluate various sterilization methods,Develop standard operation procedures,Apply knowledge of a quality assurance program for sterile compounding,Evaluate risk levels,Set up an aseptic work environment and maintain the quality of the work environment,Be aware of recent trends in development of new drug delivery systems,,,,,,,,,,,,,,,,,,,,,,,,,,,,,,,,PHARM 447 (Fall 2018 LEC A1 SEM E1),PHARM 447 Fa18 - PSYCHIATRY Combined LEC SEM Fa18,2018,Fall,Cross Listed Courses,"Pharmacy Practice,, BSc in Pharmacy, 3rd year",2,Candace Necyk,,3,23,"Outline the epidemiology, etiology and pathophysiology of the mental health conditions covered.","Describe the risk factors, clinical presentation, and assessment parameters (signs and symptoms, laboratory values/tests, physical findings and diagnostic measurements) of the conditions covered.","Explain the mechanism of action, pharmacokinetic principles, clinical effect(s), and adverse effects and drug interactions for the medication classes covered.","Describe the therapeutic approach to managing the conditions covered, including: guideline recommendations and clinical targets, pharmacological (dose, duration of therapy, monitoring parameters), non-pharmacological treatments, and CAM.",Describe the role of therapeutic drug monitoring for selected medications in the provision of patient care.,Outline the economic and health policy issues as they relate to mental health conditions.,Identify ethical issues in the management of mental health conditions.,"Conduct a patient assessment using relevant data from the patient history, review of systems, laboratory tests, diagnostic imaging and medication history in order to provide patient care.",Identify and locate sources of information needed to provide patient care.,"Develop a therapeutic and monitoring plan, taking into consideration patient factors, efficacy, toxicity, cost, route of administration, etc."," Apply principles of therapeutic drug monitoring to deliver patient care, taking into consideration health system and economic factors.",Manage clinically significant drug interactions with drugs used to treat the psychiatric conditions covered.,Utilize an evidence based approach to therapeutic management of the psychiatric conditions covered.,Evaluate and apply information from literature and other resources to provide patient care.,Utilize independent and collaborative approaches to learning.,"Develop a caring, empathic attitude for patients experiencing the conditions covered.",Develop an appreciation of the interdisciplinary nature of patient care.,Develop lifelong learning skills that will enable maintenance of competence through keeping abreast of emerging technologies and drugs.,,,,,,,,,,,,,,,,,,,,,,,,,,,,,,,,,,,,,,,,PHARM 330A (Fall 2018 LAB D3 LEC C1),PHARM 330A Fa18 - COMPREHENSIVE PATIENT ASSESS 1 Combined LAB LEC Fa18,2018,Fall,Cross Listed Courses,"BSc in Pharmacy, 2nd year",3,"Gillian Johnson, Renette Bertholet, Theresa Charrois",,5,24,Describe the differences in case presentation formats,Describe language that is appropriate for explaining risk/benefit to patients,Explain the purpose and place of patient decision aids,Describe the principles of shared decision making (SDM),Demonstrate an understanding of the standards of practices regarding: Acting professionally (Standard 1 & 2); Considering appropriate information (Standard 3); Determining the appropriateness of a prescription (Standard 6); Adaptation of prescriptions (Standard 11 & 12); Dispensing a prescription (Standard 7); Documentation (Standard 18),Differentiate the scope of practice of pharmacists and pharmacy technicians,Describe the steps of a minor ailments assessment and assess when to refer a patient,"Describe the process of medication reconciliation and seamless care, and how it applies to transitions of care","Apply the standards of practice, laws and regulations governing pharmacy practice in community pharmacy; Interpret and process prescription orders; Assess prescriptions for appropriateness; Integrate the drug use process and the patient care process in a community pharmacy setting (reviewing, processing and checking prescriptions); Apply basic pharmaceutical math in the drug use process; Discuss ethical issues and professionalism",Complete a medication reconciliation for ensuring continuity in patient care during: Admission; Discharge; Transition between facilities; Create a â€œbest possible medication discharge planâ€ù,"Demonstrate effective verbal communication skills when: conducting patient interviews, interacting with pharmacy colleagues and other healthcare professionals, communicating recommendations and rationale to patients and other health care providers; Present a case to a healthcare professionals; Present an article using a journal club format; Engage in a shared decision making (SDM) discussion to demonstrate the principles of SDM; Engage in a risk:benefit discussion of therapeutic alternatives to demonstrate ability to use appropriate language and tools","Demonstrate the mastery of a skill by teaching how to properly use and counsel on respiratory devices; Demonstrate effective written communication skills when communicating with patients, caregivers and other healthcare professionals, documenting patient care activities and when responding to drug information questions; Communication to other healthcare professionals with documentation  (DAP) notes and care plans; Prepare a discharge prescription ",Identify and report an adverse drug reaction,Demonstrate the principles of evidence based clinical practice to solve drug therapy and health related issues; Locate and apply appropriate tertiary literature in response to a clinical  question,"Educate patients and caregivers on safe, effective and appropriate medication use, health and wellness, medication administration, self-care, home health care equipment and health monitoring devices.","Create a patient database by gathering appropriate patient related  information; Assess a patient for an allergy, drug intolerance and adverse event; Assess a patientâ€™s relevant physical findings in order to evaluate drug  therapy; Assess a patient for non-adherence and develop a plan to make appropriate recommendations to patients with both intentional and non-intentional adherence ; Identify, resolve and monitor patients who have drug-related problem(s); Determine appropriateness to extend refills, adapt prescriptions, recommend changes to therapy, initiate/prescribe therapy (for minor ailments) and/or refer to physicians; Prioritize drug-related problems; Provide rationale for therapeutic decision making; Create a â€œBest possible medication listâ€ù","Apply the patient care process to patients presenting to a community pharmacy and hospital setting, including:",Display a professional attitude as outlined in professionalism expectations,Assume the role of the pharmacist in each of the activities and take responsibility and accountability.,Function as a team member/leader of an interprofessional team during group activities,,,,,,,,,,,,,,,,,,,,,,,,,,,,,,,,,,,,,,PHARM 427 (Winter 2018 LEC B1 SEM J1),PHARM 427 Wi18 - PAIN Combined LEC SEM Wi18,2018,Winter,Cross Listed Courses,"Therapeutics,, BSc in Pharmacy, 2nd year",1,John Ussher,,3,16,,,,,,,,,,,,,,,,,,,,,,,,,,,,,,,,,,,,,,,,,,,,,,,,,,,,,,,,,,PHARM 351 (LEC A1 Fa18),PHARM 351 BIOPHARMACEUTICS&PHARMACOKINET (LEC A1 Fa18),2018,Fall,Faculty of Pharmacy and Pharmaceutical Sciences,BSc in Pharmacy,2,Dr. Dion Brocks,,4,35,"Comprehend one and two compartmental models, including the underlying reasons for the appearance of more than one compartment in a plasma concentration vs. time profile.","Use the knowledge obtained from determination of pharmacokinetic parameters to devise an individualized dosing regimen for a patient, tailored to achieve a therapeutic goal of concentration and/or effect.",Comprehend concepts related to nonlinear elimination of drug.,Recognize factors that can influence the relationship between plasma concentrations and pharmacodynamics potency of drugs,Recognize the relationship between pharmacokinetics and therapeutic relevance in: a. Extremes of age b. Genetic differences in drug metabolism (polymorphism) c. Diminished renal function d. Concomitant administration of interacting drugs e. Drug disposition in maternal and infants (pregnancy and breastmilk,"Explain the following pharmacokinetic concepts:a. First and zero order rate processes. b. Rates, rate constants, and intercepts. c. Total body clearance (CL). d. Volume of distribution (Vd).","Understand the relationship between organ clearance and total body clearance, and detail the mechanisms involved in renal and hepatic drug clearance of a particular drug.","Identify the relationships between different pharmacokinetic parameters and blood fluid concentrations after drug administration by the intravenous, oral and injectable routes.",Grasp the concept of steady state and its dependency on half-life in relation to constant intravenous infusion and repeated dose administration.,"Determine CL, Vd, and other dependent pharmacokinetic parameters (half-life, maximum concentration after dosing, area under the concentration vs. time curve) from plasma concentration vs. time data.","Use knowledge related to measures of organ clearance to predict changes in blood levels when physiological 3 factors or clinical conditions are present that may affect blood flows, intrinsic clearance and transporter function.",Become proactive in including and considering concepts of therapeutic drug monitoring in practice skills.,,,,,,,,,,,,,,,,,,,,,,,,,,,,,,,,,,,,,,,,,,,,,,PHARM 437 (Winter 2018 LEC B1 SEM J1),PHARM 437 Wi18 - BONE AND JOINT Combined LEC SEM Wi18,2018,Winter,Cross Listed Courses,,3,Dr. Dion Brocks,,0,2,"Outline the epidemiology, etiology and pathophysiology of the reproductive & sexual health and musculoskeletal/joint conditions covered.","Describe the risk factors, clinical presentation, and assessment parameters (signs and symptoms, laboratory values/tests, physical findings and diagnostic measurements) of the conditions covered. ","Explain the mechanism of action, pharmacokinetic principles, clinical effect(s), adverse effects & drug interactions for the medication classes covered.","Describe the therapeutic approach to managing the conditions covered, including:","a. guideline recommendations and clinical targets,","b. pharmacological (dose, duration of therapy, monitoring parameters),","c. non-pharmacological treatments, and",d. CAM.,Outline the economic and health policy issues as they relate to reproductive & sexual health and musculoskeletal/joint conditions covered.,Identify ethical issues in the management of reproductive & sexual health and musculoskeletal/joint conditions covered.,"Conduct a patient assessment using relevant data from the patient history, review of systems, laboratory tests, diagnostic imaging and drug therapy in order to provide patient care.",Identify and locate sources of information needed to provide patient care.,"Develop a therapeutic and monitoring plan, taking into consideration patient factors, efficacy, toxicity, cost, route of administration etc.",Manage clinically significant drug interactions involving medications used to treat reproductive & sexual health and musculoskeletal/joint conditions.,Utilize an evidence-based approach to therapeutic management of reproductive & sexual health and musculoskeletal/joint conditions.,Evaluate and apply information from literature and other resources to provide patient care.,Utilize independent and collaborative approaches to learning.,"Develop a caring, empathic attitude for patients experiencing the conditions covered.",Develop an appreciation of the interdisciplinary nature of patient care.,Appreciate the need for lifelong learning skills that will enable maintenance of competence through keeping abreast of emerging technologies and drugs.,,,,,,,,,,,,,,,,,,,,,,,,,,,,,,,,,,,,,,PHARM 397 (Fall 2018 LEC A1 SEM E1),"PHARM 397 Fa18 - VALUES, UROLOGY & NEPHROLOGY Combined LEC SEM Fa18",2018,Fall,Cross Listed Courses,"Therapeutics,, BSc in Pharmacy, 2nd year",2,Michael Doschak,,5,27,"Describe the anatomy of the kidney, ureters, bladder, and urethra.","Describe the physiology of the ureters, bladder and urethra including a general outline of bladder function and micturition.","Describe the physiology of the kidney including regulation of glomerular filtration, sodium/water balance, fluid balance, acid-base balance as well as other electrolytes, tubular reabsorption and secretion.","Explain the major functions and consequences of disturbances of: sodium, potassium, magnesium, calcium, and phosphate.","Describe the etiology, pathophysiology, clinical presentation, and compensatory mechanism of the four acid-base disorders.","Describe the pathophysiology of renal disorders including acute kidney injury, chronic kidney disease, nephrolithiasis, and incontinence including clinical presentation and symptomatology and long term health consequences","Describe the epidemiology, etiology, and risk factors of the following: renal disorders including acute kidney injury, nephrolithiasis, Chronic Kidney Disease, and LUTS.","Explain and interpret pertinent serum chemistry laboratory values, as well as specific laboratory tests used in the diagnosis and monitoring of acute kidney injury, chronic kidney disease, nephrolithiasis, and lower urinary tract symptoms (LUTS).",Identify the role and the responsibility of the pharmacist within the course of the disease state and its therapy.,"Describe the therapeutic approach incorporating non-pharmacologic and pharmacologic treatments for electrolyte disorders, acid-base disorders, acute kidney injury, chronic kidney disease, nephrolithiasis, and LUTS including use of specific target drugs for the condition as well as alternative therapies (dose, route of administration, length of therapy, monitoring parameters).","Explain the effects of drugs used in the management of electrolyte disorders, acute kidney injury, chronic kidney disease, nephrolithiasis, and LUTS.","Identify medications which can cause renal toxicity, and describe the appropriate management.","Describe the principles of the various Renal Replacement Therapies (Hemodialysis, Peritoneal Dialysis, and Continuous Renal Replacement Therapy). ",Describe the societal and economic impact of LUTS,"Explain the interdisciplinary approach to acute kidney injury, chronic kidney disease nephrolithiasis, and LUTS management.","Assess fluid balance based on medical history as well as presenting signs and symptoms, and recommend appropriate management of the patient.",Calculate creatinine clearance and adjust doses for medications that are renally eliminated.,"Identify the presenting signs and symptoms of electrolyte disorders, acid-base disorders, acute kidney injury, chronic kidney disease, nephrolithiasis, and LUTS and describe criteria used to make the diagnosis.",Identify when to inform physicians and caregivers if there are danger signs apparent in the assessment.,Assess lab data in order to manage medical condition and medication regimen.  ,"Discuss the therapeutic options, including risks and benefits, and medication and alternative therapy choices.",Identify appropriate monitoring parameters.,Recommend appropriate changes to therapy based on patient outcomes and monitoring parameters.,"Apply concepts and knowledge of pharmacology and therapeutic principles in selecting and monitoring drug therapy for the management of electrolyte disorders (hyper/hyponatremia, hyper/hypokalemia), acid-base disorders, acute kidney injury, chronic kidney disease nephrolithiasis, and LUTS.",Describe how to triage a given patient in a community setting and identify when to refer them to medical attention as appropriate.,"Design pharmaceutical care plans including alternatives (drug, non-drug), recommendations, implementation, monitoring and follow up for patients with electrolyte disorders, acute kidney injury, nephrolithiasis, and LUTS",For each of the conditions described the student should:," Identify actual and potential drug-related problems relating to electrolyte disorders, acute kidney injury, chronic kidney disease, nephrolithiasis, and LUTS in patient cases.",Identify and locate sources of information needed to solve drug-related problems ,"Utilize an evidence-based approach to therapeutic management of electrolyte disorders, acid-base disorders, acute renal failure, chronic kidney disease, nephrolithiasis, and LUTS.","Identify actual and potential drug-related problems relating to electrolyte disorders, acute kidney injury, chronic kidney disease, nephrolithiasis, and LUTS in patient cases.",Accept responsibility for keeping abreast of emerging technologies and drugs,"Develop a caring, empathic attitude for patients experiencing the conditions of primary focus. ",Work effectively within the healthcare team.,Develop an appreciation of the interdisciplinary nature of patient care.,,,,,,,,,,,,,,,,,,,,,,,PHARM 387 (Winter 2018 LEC B1 SEM J1),PHARM 387 Wi18 - PEDIATRICS / GERIATRICS Combined LEC SEM Wi18,2018,Winter,Cross Listed Courses,"Therapeutics,, Behavioural, Social and Administrative Sciences, BSc in Pharmacy, 3rd year",1.5,Cheryl Sadowski,,4,23,Describe the challenges of providing care in a population with limited evidence.,"Describe the use and effect of drugs, pharmacoepidemiology, including prescription, non-prescription medication, and natural health products.","Describe risks for adverse drug events in pediatric and geriatric patients, and explain why they are more susceptible to adverse events.",Identify and describe age-appropriate communication strategies.,"Describe the role that culture, religion, and ethnicity may play in health and decision-making.",Identify controversial health issues involving pediatric and geriatric populations,"Define and be able to use the following terms in a clinical context: geriatrics, gerontology, elderly, aging, frailty.",Describe common stereotypes and biases toward aging in our western society.," Explain the demographics of aging, and how that may impact society and the healthcare system.",Briefly describe the psychosocial aspects of aging and be able to explain the role of the pharmacist in dealing with these aspects.,Describe the physiologic alterations associated with normal aging that modify drug response in the elderly patient.,"Describe the pharmacokinetic and pharmacodynamic changes associated with aging, and apply the principles to medications commonly used in geriatrics.", List the most common chronic diseases and causes of death in seniors.,Contrast disease presentation between the young adult and the elderly adult.,Identify medications that are considered inappropriate or high risk in older adults and explain why they are inappropriate or high risk.,Describe how criteria were developed to classify medications as appropriate or inappropriate in seniors.,Define polypharmacy and underutilization in terms of medications in seniors.,Contrast the presentation of adverse events in the elderly compared to the young adult.,Describe the impact of falls on the senior population.,Identify risk factors for falls in older individuals.,Describe appropriate interventions for falls.,Contrast how a geriatric syndrome is different than a disease state.,List the common geriatric syndromes.,Discuss the role of the pharmacist in medication management of seniors.,Identify methods of appropriately communicating with older adults who are hard of hearing.,Describe the role of the pharmacist in working with home care.,Identify appropriate home care supports for a given patient.,Categorize the types of abuse commonly suffered by seniors.,Describe the role of the pharmacist in reducing elder abuse,"Explain the demographics of the pediatric population in society, and explain how that may impact our role as pharmacists. (e.g. improvement of childhood illnesses, trend towards chronic disease management)","Identify and discuss some of the challenges involved in treating the pediatric population, including communication strategies, presentation of illness and the management and administration of medications to infants and children.",Discuss the importance of medication safety and identify measures used to ensure safe medication practices,Review pediatric toxicology and discuss preventative interventions that pharmacists can promote to patients or utilize in their practice to minimize pediatric toxicological poisonings or incidences.,Discuss basic neonatal care and challenges including premature birth.,Explain how pharmacokinetic parameters are different in infants and children versus adults.," Explain the significant differences in physiologic parameters between adolescents, children, toddlers and infants, including premature babies, and neonates",Identify and discuss appropriate management plans for common pediatric concerns such as teething and fevers.,"Identify and discuss appropriate management plans for common pediatric gastrointestinal illnesses (e.g. vomiting, diarrhea, dehydration, colic, and constipation).",Discuss presentation and treatment for common pulmonary pediatric illnesses; croup and bronchiolitis.,"Describe the various forms of pediatric abuse and discuss the Child, Youth and Family Enhancement Act and the responsibilities that are associated with the Act",Discuss the management and implications involved with a diagnosis of autism.,Describe the role of pharmacists in the care of pediatric and geriatric patients.,Use tools to assess medication appropriateness and medication management in seniors.,Be able to triage patients in a community setting and refer them to medical attention as appropriate.,Apply applicable pharmacokinetic parameters to monitor patients and assess appropriate use of medications., Apply knowledge and skills to establish safe and effective drug use.,Utilize when available an evidence-based approach to therapeutic management of pediatric and geriatric patients.,Identify sources of information needed to solve drug-related problems specific to the populations being studied.,Identify and be able to recommend aids to assist in medication management and administration.,"Empathize with children, older adults, and caregivers regarding challenging decision-making.",Take and defend a position on a controversy related to pediatrics and geriatrics using evidence-based arguments.,Prepare and present a personal script to address a controversial topic.,Communicate position through oral and written formats.,"Develop a caring, empathic attitude for and response to pediatric and geriatric patients","Develop an appreciation of the comprehensive, interdisciplinary nature of patient care for children and older adults",Appreciate the challenges related to decision-making and advocacy in grey areas of clinical practice and health.,,